<?xml version="1.0" encoding="UTF-8"?>
<!DOCTYPE Communities [
<!ELEMENT Communities (Community+)>
<!ELEMENT Community (Attribute+, Entity*)>
<!ATTLIST Community Name CDATA #REQUIRED>

<!ELEMENT Entity (Attribute*)>
<!ATTLIST Entity Name CDATA #REQUIRED>

<!ELEMENT Attribute EMPTY>
<!ATTLIST Attribute ID CDATA #REQUIRED>
<!ATTLIST Attribute Value CDATA #REQUIRED>
]>

<Communities>
  <Community Name="1-AD-COMM" >
    <Attribute ID="CommunityType" Value="Domain" />
    <Entity Name="1-AD" >
      <Attribute ID="EntityType" Value="Agent" />
      <Attribute ID="Role" Value="Member" />
    </Entity>
    <Entity Name="1-AD-DIV-COMM" >
      <Attribute ID="EntityType" Value="Community" />
      <Attribute ID="Role" Value="Member" />
    </Entity>
    <Entity Name="1-BDE-1-AD-COMM" >
      <Attribute ID="EntityType" Value="Community" />
      <Attribute ID="Role" Value="Member" />
    </Entity>
    <Entity Name="2-BDE-1-AD-COMM" >
      <Attribute ID="EntityType" Value="Community" />
      <Attribute ID="Role" Value="Member" />
    </Entity>
    <Entity Name="3-BDE-1-AD-COMM" >
      <Attribute ID="EntityType" Value="Community" />
      <Attribute ID="Role" Value="Member" />
    </Entity>
    <Entity Name="AVNBDE-1-AD-COMM" >
      <Attribute ID="EntityType" Value="Community" />
      <Attribute ID="Role" Value="Member" />
    </Entity>
    <Entity Name="DISCOM-1-AD-COMM" >
      <Attribute ID="EntityType" Value="Community" />
      <Attribute ID="Role" Value="Member" />
    </Entity>
    <Entity Name="DIVARTY-1-AD-COMM" >
      <Attribute ID="EntityType" Value="Community" />
      <Attribute ID="Role" Value="Member" />
    </Entity>
  </Community>
  <Community Name="1-AD-DIV-COMM" >
    <Attribute ID="CommunityType" Value="Domain" />
    <Entity Name="1-4-ADABN" >
      <Attribute ID="EntityType" Value="Agent" />
      <Attribute ID="Role" Value="Member" />
    </Entity>
    <Entity Name="1-AD-DIV" >
      <Attribute ID="EntityType" Value="Agent" />
      <Attribute ID="Role" Value="Member" />
    </Entity>
    <Entity Name="141-SIGBN" >
      <Attribute ID="EntityType" Value="Agent" />
      <Attribute ID="Role" Value="Member" />
    </Entity>
    <Entity Name="501-MIBN-CEWI" >
      <Attribute ID="EntityType" Value="Agent" />
      <Attribute ID="Role" Value="Member" />
    </Entity>
    <Entity Name="501-MPCO" >
      <Attribute ID="EntityType" Value="Agent" />
      <Attribute ID="Role" Value="Member" />
    </Entity>
    <Entity Name="69-CHEMCO" >
      <Attribute ID="EntityType" Value="Agent" />
      <Attribute ID="Role" Value="Member" />
    </Entity>
  </Community>
  <Community Name="1-BDE-1-AD-COMM" >
    <Attribute ID="CommunityType" Value="Domain" />
    <Entity Name="1-36-INFBN" >
      <Attribute ID="EntityType" Value="Agent" />
      <Attribute ID="Role" Value="Member" />
    </Entity>
    <Entity Name="1-37-ARBN" >
      <Attribute ID="EntityType" Value="Agent" />
      <Attribute ID="Role" Value="Member" />
    </Entity>
    <Entity Name="1-BDE-1-AD" >
      <Attribute ID="EntityType" Value="Agent" />
      <Attribute ID="Role" Value="Member" />
    </Entity>
    <Entity Name="16-ENGBN" >
      <Attribute ID="EntityType" Value="Agent" />
      <Attribute ID="Role" Value="Member" />
    </Entity>
    <Entity Name="2-3-FABN" >
      <Attribute ID="EntityType" Value="Agent" />
      <Attribute ID="Role" Value="Member" />
    </Entity>
    <Entity Name="2-37-ARBN" >
      <Attribute ID="EntityType" Value="Agent" />
      <Attribute ID="Role" Value="Member" />
    </Entity>
    <Entity Name="501-FSB" >
      <Attribute ID="EntityType" Value="Agent" />
      <Attribute ID="Role" Value="Member" />
    </Entity>
  </Community>
  <Community Name="16-CSG-COMM" >
    <Attribute ID="CommunityType" Value="Domain" />
    <Entity Name="102-POL-SUPPLYCO" >
      <Attribute ID="EntityType" Value="Agent" />
      <Attribute ID="Role" Value="Member" />
    </Entity>
    <Entity Name="106-TCBN" >
      <Attribute ID="EntityType" Value="Agent" />
      <Attribute ID="Role" Value="Member" />
    </Entity>
    <Entity Name="15-PLS-TRKCO" >
      <Attribute ID="EntityType" Value="Agent" />
      <Attribute ID="Role" Value="Member" />
    </Entity>
    <Entity Name="16-CSG" >
      <Attribute ID="EntityType" Value="Agent" />
      <Attribute ID="Role" Value="Member" />
    </Entity>
    <Entity Name="18-MAINTBN" >
      <Attribute ID="EntityType" Value="Agent" />
      <Attribute ID="Role" Value="Member" />
    </Entity>
    <Entity Name="226-MAINTCO" >
      <Attribute ID="EntityType" Value="Agent" />
      <Attribute ID="Role" Value="Member" />
    </Entity>
    <Entity Name="227-SUPPLYCO" >
      <Attribute ID="EntityType" Value="Agent" />
      <Attribute ID="Role" Value="Member" />
    </Entity>
    <Entity Name="238-POL-TRKCO" >
      <Attribute ID="EntityType" Value="Agent" />
      <Attribute ID="Role" Value="Member" />
    </Entity>
    <Entity Name="26-SSCO" >
      <Attribute ID="EntityType" Value="Agent" />
      <Attribute ID="Role" Value="Member" />
    </Entity>
    <Entity Name="263-FLDSVC-CO" >
      <Attribute ID="EntityType" Value="Agent" />
      <Attribute ID="Role" Value="Member" />
    </Entity>
    <Entity Name="372-CGO-TRANSCO" >
      <Attribute ID="EntityType" Value="Agent" />
      <Attribute ID="Role" Value="Member" />
    </Entity>
    <Entity Name="485-CSB" >
      <Attribute ID="EntityType" Value="Agent" />
      <Attribute ID="Role" Value="Member" />
    </Entity>
    <Entity Name="588-MAINTCO" >
      <Attribute ID="EntityType" Value="Agent" />
      <Attribute ID="Role" Value="Member" />
    </Entity>
    <Entity Name="592-ORDCO" >
      <Attribute ID="EntityType" Value="Agent" />
      <Attribute ID="Role" Value="Member" />
    </Entity>
    <Entity Name="594-MDM-TRKCO" >
      <Attribute ID="EntityType" Value="Agent" />
      <Attribute ID="Role" Value="Member" />
    </Entity>
    <Entity Name="596-MAINTCO" >
      <Attribute ID="EntityType" Value="Agent" />
      <Attribute ID="Role" Value="Member" />
    </Entity>
    <Entity Name="77-MAINTCO" >
      <Attribute ID="EntityType" Value="Agent" />
      <Attribute ID="Role" Value="Member" />
    </Entity>
  </Community>
  <Community Name="2-BDE-1-AD-COMM" >
    <Attribute ID="CommunityType" Value="Domain" />
    <Entity Name="1-35-ARBN" >
      <Attribute ID="EntityType" Value="Agent" />
      <Attribute ID="Role" Value="Member" />
    </Entity>
    <Entity Name="1-6-INFBN" >
      <Attribute ID="EntityType" Value="Agent" />
      <Attribute ID="Role" Value="Member" />
    </Entity>
    <Entity Name="2-6-INFBN" >
      <Attribute ID="EntityType" Value="Agent" />
      <Attribute ID="Role" Value="Member" />
    </Entity>
    <Entity Name="2-BDE-1-AD" >
      <Attribute ID="EntityType" Value="Agent" />
      <Attribute ID="Role" Value="Member" />
    </Entity>
    <Entity Name="4-27-FABN" >
      <Attribute ID="EntityType" Value="Agent" />
      <Attribute ID="Role" Value="Member" />
    </Entity>
    <Entity Name="40-ENGBN" >
      <Attribute ID="EntityType" Value="Agent" />
      <Attribute ID="Role" Value="Member" />
    </Entity>
    <Entity Name="47-FSB" >
      <Attribute ID="EntityType" Value="Agent" />
      <Attribute ID="Role" Value="Member" />
    </Entity>
  </Community>
  <Community Name="21-TSC-COMM" >
    <Attribute ID="CommunityType" Value="Domain" />
    <Entity Name="200-MMC" >
      <Attribute ID="EntityType" Value="Agent" />
      <Attribute ID="Role" Value="Member" />
    </Entity>
    <Entity Name="21-TSC-HQ" >
      <Attribute ID="EntityType" Value="Agent" />
      <Attribute ID="Role" Value="Member" />
    </Entity>
    <Entity Name="29-SPTGP-COMM" >
      <Attribute ID="EntityType" Value="Community" />
      <Attribute ID="Role" Value="Member" />
    </Entity>
    <Entity Name="37-TRANSGP-COMM" >
      <Attribute ID="EntityType" Value="Community" />
      <Attribute ID="Role" Value="Member" />
    </Entity>
    <Entity Name="7-TCGP-TPTDD" >
      <Attribute ID="EntityType" Value="Agent" />
      <Attribute ID="Role" Value="Member" />
    </Entity>
    <Entity Name="AWR-2" >
      <Attribute ID="EntityType" Value="Agent" />
      <Attribute ID="Role" Value="Member" />
    </Entity>
    <Entity Name="RSA" >
      <Attribute ID="EntityType" Value="Agent" />
      <Attribute ID="Role" Value="Member" />
    </Entity>
  </Community>
  <Community Name="29-SPTGP-COMM" >
    <Attribute ID="CommunityType" Value="Domain" />
    <Entity Name="18-PERISH-SUBPLT" >
      <Attribute ID="EntityType" Value="Agent" />
      <Attribute ID="Role" Value="Member" />
    </Entity>
    <Entity Name="191-ORDBN" >
      <Attribute ID="EntityType" Value="Agent" />
      <Attribute ID="Role" Value="Member" />
    </Entity>
    <Entity Name="23-ORDCO" >
      <Attribute ID="EntityType" Value="Agent" />
      <Attribute ID="Role" Value="Member" />
    </Entity>
    <Entity Name="24-ORDCO" >
      <Attribute ID="EntityType" Value="Agent" />
      <Attribute ID="Role" Value="Member" />
    </Entity>
    <Entity Name="29-SPTGP" >
      <Attribute ID="EntityType" Value="Agent" />
      <Attribute ID="Role" Value="Member" />
    </Entity>
    <Entity Name="343-SUPPLYCO" >
      <Attribute ID="EntityType" Value="Agent" />
      <Attribute ID="Role" Value="Member" />
    </Entity>
    <Entity Name="5-MAINTCO" >
      <Attribute ID="EntityType" Value="Agent" />
      <Attribute ID="Role" Value="Member" />
    </Entity>
    <Entity Name="51-MAINTBN" >
      <Attribute ID="EntityType" Value="Agent" />
      <Attribute ID="Role" Value="Member" />
    </Entity>
    <Entity Name="512-MAINTCO" >
      <Attribute ID="EntityType" Value="Agent" />
      <Attribute ID="Role" Value="Member" />
    </Entity>
    <Entity Name="574-SSCO" >
      <Attribute ID="EntityType" Value="Agent" />
      <Attribute ID="Role" Value="Member" />
    </Entity>
    <Entity Name="702-EODDET" >
      <Attribute ID="EntityType" Value="Agent" />
      <Attribute ID="Role" Value="Member" />
    </Entity>
    <Entity Name="720-EODDET" >
      <Attribute ID="EntityType" Value="Agent" />
      <Attribute ID="Role" Value="Member" />
    </Entity>
  </Community>
  <Community Name="3-BDE-1-AD-COMM" >
    <Attribute ID="CommunityType" Value="Domain" />
    <Entity Name="1-13-ARBN" >
      <Attribute ID="EntityType" Value="Agent" />
      <Attribute ID="Role" Value="Member" />
    </Entity>
    <Entity Name="1-41-INFBN" >
      <Attribute ID="EntityType" Value="Agent" />
      <Attribute ID="Role" Value="Member" />
    </Entity>
    <Entity Name="125-FSB" >
      <Attribute ID="EntityType" Value="Agent" />
      <Attribute ID="Role" Value="Member" />
    </Entity>
    <Entity Name="2-70-ARBN" >
      <Attribute ID="EntityType" Value="Agent" />
      <Attribute ID="Role" Value="Member" />
    </Entity>
    <Entity Name="3-BDE-1-AD" >
      <Attribute ID="EntityType" Value="Agent" />
      <Attribute ID="Role" Value="Member" />
    </Entity>
    <Entity Name="4-1-FABN" >
      <Attribute ID="EntityType" Value="Agent" />
      <Attribute ID="Role" Value="Member" />
    </Entity>
    <Entity Name="70-ENGBN" >
      <Attribute ID="EntityType" Value="Agent" />
      <Attribute ID="Role" Value="Member" />
    </Entity>
  </Community>
  <Community Name="3-SUPCOM-COMM" >
    <Attribute ID="CommunityType" Value="Domain" />
    <Entity Name="16-CSG-COMM" >
      <Attribute ID="EntityType" Value="Community" />
      <Attribute ID="Role" Value="Member" />
    </Entity>
    <Entity Name="19-MMC" >
      <Attribute ID="EntityType" Value="Agent" />
      <Attribute ID="Role" Value="Member" />
    </Entity>
    <Entity Name="208-SCCO" >
      <Attribute ID="EntityType" Value="Agent" />
      <Attribute ID="Role" Value="Member" />
    </Entity>
    <Entity Name="27-TCBN-MVTCTRL" >
      <Attribute ID="EntityType" Value="Agent" />
      <Attribute ID="Role" Value="Member" />
    </Entity>
    <Entity Name="3-SUPCOM-HQ" >
      <Attribute ID="EntityType" Value="Agent" />
      <Attribute ID="Role" Value="Member" />
    </Entity>
    <Entity Name="7-CSG-COMM" >
      <Attribute ID="EntityType" Value="Community" />
      <Attribute ID="Role" Value="Member" />
    </Entity>
  </Community>
  <Community Name="37-TRANSGP-COMM" >
    <Attribute ID="CommunityType" Value="Domain" />
    <Entity Name="109-MDM-TRKCO" >
      <Attribute ID="EntityType" Value="Agent" />
      <Attribute ID="Role" Value="Member" />
    </Entity>
    <Entity Name="110-POL-SUPPLYCO" >
      <Attribute ID="EntityType" Value="Agent" />
      <Attribute ID="Role" Value="Member" />
    </Entity>
    <Entity Name="28-TCBN" >
      <Attribute ID="EntityType" Value="Agent" />
      <Attribute ID="Role" Value="Member" />
    </Entity>
    <Entity Name="37-TRANSGP" >
      <Attribute ID="EntityType" Value="Agent" />
      <Attribute ID="Role" Value="Member" />
    </Entity>
    <Entity Name="416-POL-TRKCO" >
      <Attribute ID="EntityType" Value="Agent" />
      <Attribute ID="Role" Value="Member" />
    </Entity>
    <Entity Name="6-TCBN" >
      <Attribute ID="EntityType" Value="Agent" />
      <Attribute ID="Role" Value="Member" />
    </Entity>
    <Entity Name="632-MAINTCO" >
      <Attribute ID="EntityType" Value="Agent" />
      <Attribute ID="Role" Value="Member" />
    </Entity>
    <Entity Name="66-MDM-TRKCO" >
      <Attribute ID="EntityType" Value="Agent" />
      <Attribute ID="Role" Value="Member" />
    </Entity>
    <Entity Name="68-MDM-TRKCO" >
      <Attribute ID="EntityType" Value="Agent" />
      <Attribute ID="Role" Value="Member" />
    </Entity>
  </Community>
  <Community Name="5-CORPS-ARTY-COMM" >
    <Attribute ID="CommunityType" Value="Domain" />
    <Entity Name="1-27-FABN" >
      <Attribute ID="EntityType" Value="Agent" />
      <Attribute ID="Role" Value="Member" />
    </Entity>
    <Entity Name="2-4-FABN-MLRS" >
      <Attribute ID="EntityType" Value="Agent" />
      <Attribute ID="Role" Value="Member" />
    </Entity>
    <Entity Name="3-13-FABN-155" >
      <Attribute ID="EntityType" Value="Agent" />
      <Attribute ID="Role" Value="Member" />
    </Entity>
    <Entity Name="41-FABDE" >
      <Attribute ID="EntityType" Value="Agent" />
      <Attribute ID="Role" Value="Member" />
    </Entity>
    <Entity Name="5-CORPS-ARTY" >
      <Attribute ID="EntityType" Value="Agent" />
      <Attribute ID="Role" Value="Member" />
    </Entity>
  </Community>
  <Community Name="5-CORPS-COMM" >
    <Attribute ID="CommunityType" Value="Domain" />
    <Entity Name="1-AD-COMM" >
      <Attribute ID="EntityType" Value="Community" />
      <Attribute ID="Role" Value="Member" />
    </Entity>
    <Entity Name="3-SUPCOM-COMM" >
      <Attribute ID="EntityType" Value="Community" />
      <Attribute ID="Role" Value="Member" />
    </Entity>
    <Entity Name="5-CORPS" >
      <Attribute ID="EntityType" Value="Agent" />
      <Attribute ID="Role" Value="Member" />
    </Entity>
    <Entity Name="5-CORPS-ARTY-COMM" >
      <Attribute ID="EntityType" Value="Community" />
      <Attribute ID="Role" Value="Member" />
    </Entity>
    <Entity Name="5-CORPS-REAR-COMM" >
      <Attribute ID="EntityType" Value="Community" />
      <Attribute ID="Role" Value="Member" />
    </Entity>
  </Community>
  <Community Name="5-CORPS-REAR-COMM" >
    <Attribute ID="CommunityType" Value="Domain" />
    <Entity Name="11-AVN-RGT" >
      <Attribute ID="EntityType" Value="Agent" />
      <Attribute ID="Role" Value="Member" />
    </Entity>
    <Entity Name="12-AVNBDE" >
      <Attribute ID="EntityType" Value="Agent" />
      <Attribute ID="Role" Value="Member" />
    </Entity>
    <Entity Name="130-ENGBDE" >
      <Attribute ID="EntityType" Value="Agent" />
      <Attribute ID="Role" Value="Member" />
    </Entity>
    <Entity Name="18-MPBDE" >
      <Attribute ID="EntityType" Value="Agent" />
      <Attribute ID="Role" Value="Member" />
    </Entity>
    <Entity Name="205-MIBDE" >
      <Attribute ID="EntityType" Value="Agent" />
      <Attribute ID="Role" Value="Member" />
    </Entity>
    <Entity Name="22-SIGBDE" >
      <Attribute ID="EntityType" Value="Agent" />
      <Attribute ID="Role" Value="Member" />
    </Entity>
    <Entity Name="244-ENGBN-CBTHVY" >
      <Attribute ID="EntityType" Value="Agent" />
      <Attribute ID="Role" Value="Member" />
    </Entity>
    <Entity Name="286-ADA-SCCO" >
      <Attribute ID="EntityType" Value="Agent" />
      <Attribute ID="Role" Value="Member" />
    </Entity>
    <Entity Name="30-MEDBDE" >
      <Attribute ID="EntityType" Value="Agent" />
      <Attribute ID="Role" Value="Member" />
    </Entity>
    <Entity Name="5-CORPS-REAR" >
      <Attribute ID="EntityType" Value="Agent" />
      <Attribute ID="Role" Value="Member" />
    </Entity>
    <Entity Name="52-ENGBN-CBTHVY" >
      <Attribute ID="EntityType" Value="Agent" />
      <Attribute ID="Role" Value="Member" />
    </Entity>
    <Entity Name="69-ADABDE" >
      <Attribute ID="EntityType" Value="Agent" />
      <Attribute ID="Role" Value="Member" />
    </Entity>
  </Community>
  <Community Name="7-CSG-COMM" >
    <Attribute ID="CommunityType" Value="Domain" />
    <Entity Name="125-ORDBN" >
      <Attribute ID="EntityType" Value="Agent" />
      <Attribute ID="Role" Value="Member" />
    </Entity>
    <Entity Name="181-TCBN" >
      <Attribute ID="EntityType" Value="Agent" />
      <Attribute ID="Role" Value="Member" />
    </Entity>
    <Entity Name="240-SSCO" >
      <Attribute ID="EntityType" Value="Agent" />
      <Attribute ID="Role" Value="Member" />
    </Entity>
    <Entity Name="316-POL-SUPPLYBN" >
      <Attribute ID="EntityType" Value="Agent" />
      <Attribute ID="Role" Value="Member" />
    </Entity>
    <Entity Name="317-MAINTCO" >
      <Attribute ID="EntityType" Value="Agent" />
      <Attribute ID="Role" Value="Member" />
    </Entity>
    <Entity Name="377-HVY-TRKCO" >
      <Attribute ID="EntityType" Value="Agent" />
      <Attribute ID="Role" Value="Member" />
    </Entity>
    <Entity Name="41-POL-TRKCO" >
      <Attribute ID="EntityType" Value="Agent" />
      <Attribute ID="Role" Value="Member" />
    </Entity>
    <Entity Name="452-ORDCO" >
      <Attribute ID="EntityType" Value="Agent" />
      <Attribute ID="Role" Value="Member" />
    </Entity>
    <Entity Name="51-MDM-TRKCO" >
      <Attribute ID="EntityType" Value="Agent" />
      <Attribute ID="Role" Value="Member" />
    </Entity>
    <Entity Name="515-POL-TRKCO" >
      <Attribute ID="EntityType" Value="Agent" />
      <Attribute ID="Role" Value="Member" />
    </Entity>
    <Entity Name="529-ORDCO" >
      <Attribute ID="EntityType" Value="Agent" />
      <Attribute ID="Role" Value="Member" />
    </Entity>
    <Entity Name="541-POL-TRKCO" >
      <Attribute ID="EntityType" Value="Agent" />
      <Attribute ID="Role" Value="Member" />
    </Entity>
    <Entity Name="561-SSBN" >
      <Attribute ID="EntityType" Value="Agent" />
      <Attribute ID="Role" Value="Member" />
    </Entity>
    <Entity Name="565-RPRPTCO" >
      <Attribute ID="EntityType" Value="Agent" />
      <Attribute ID="Role" Value="Member" />
    </Entity>
    <Entity Name="584-MAINTCO" >
      <Attribute ID="EntityType" Value="Agent" />
      <Attribute ID="Role" Value="Member" />
    </Entity>
    <Entity Name="597-MAINTCO" >
      <Attribute ID="EntityType" Value="Agent" />
      <Attribute ID="Role" Value="Member" />
    </Entity>
    <Entity Name="7-CSG" >
      <Attribute ID="EntityType" Value="Agent" />
      <Attribute ID="Role" Value="Member" />
    </Entity>
    <Entity Name="71-MAINTBN" >
      <Attribute ID="EntityType" Value="Agent" />
      <Attribute ID="Role" Value="Member" />
    </Entity>
    <Entity Name="71-ORDCO" >
      <Attribute ID="EntityType" Value="Agent" />
      <Attribute ID="Role" Value="Member" />
    </Entity>
    <Entity Name="900-POL-SUPPLYCO" >
      <Attribute ID="EntityType" Value="Agent" />
      <Attribute ID="Role" Value="Member" />
    </Entity>
  </Community>
  <Community Name="ALSUPPLY-COMM" >
    <Attribute ID="CommunityManager" Value="5-CORPS" />
    <Attribute ID="CommunityType" Value="AdaptiveLogistics" />
    <Entity Name="1-1-CAVSQDN" >
      <Attribute ID="EntityType" Value="Agent" />
      <Attribute ID="Role" Value="Member" />
    </Entity>
    <Entity Name="1-13-ARBN" >
      <Attribute ID="EntityType" Value="Agent" />
      <Attribute ID="Role" Value="Member" />
    </Entity>
    <Entity Name="1-27-FABN" >
      <Attribute ID="EntityType" Value="Agent" />
      <Attribute ID="Role" Value="Member" />
    </Entity>
    <Entity Name="1-35-ARBN" >
      <Attribute ID="EntityType" Value="Agent" />
      <Attribute ID="Role" Value="Member" />
    </Entity>
    <Entity Name="1-36-INFBN" >
      <Attribute ID="EntityType" Value="Agent" />
      <Attribute ID="Role" Value="Member" />
    </Entity>
    <Entity Name="1-37-ARBN" >
      <Attribute ID="EntityType" Value="Agent" />
      <Attribute ID="Role" Value="Member" />
    </Entity>
    <Entity Name="1-4-ADABN" >
      <Attribute ID="EntityType" Value="Agent" />
      <Attribute ID="Role" Value="Member" />
    </Entity>
    <Entity Name="1-41-INFBN" >
      <Attribute ID="EntityType" Value="Agent" />
      <Attribute ID="Role" Value="Member" />
    </Entity>
    <Entity Name="1-501-AVNBN" >
      <Attribute ID="EntityType" Value="Agent" />
      <Attribute ID="Role" Value="Member" />
    </Entity>
    <Entity Name="1-6-INFBN" >
      <Attribute ID="EntityType" Value="Agent" />
      <Attribute ID="Role" Value="Member" />
    </Entity>
    <Entity Name="1-94-FABN" >
      <Attribute ID="EntityType" Value="Agent" />
      <Attribute ID="Role" Value="Member" />
    </Entity>
    <Entity Name="1-AD" >
      <Attribute ID="EntityType" Value="Agent" />
      <Attribute ID="Role" Value="Member" />
    </Entity>
    <Entity Name="1-AD-DIV" >
      <Attribute ID="EntityType" Value="Agent" />
      <Attribute ID="Role" Value="Member" />
    </Entity>
    <Entity Name="1-BDE-1-AD" >
      <Attribute ID="EntityType" Value="Agent" />
      <Attribute ID="Role" Value="Member" />
    </Entity>
    <Entity Name="102-POL-SUPPLYCO" >
      <Attribute ID="EntityType" Value="Agent" />
      <Attribute ID="Role" Value="Member" />
    </Entity>
    <Entity Name="106-TCBN" >
      <Attribute ID="EntityType" Value="Agent" />
      <Attribute ID="Role" Value="Member" />
    </Entity>
    <Entity Name="109-MDM-TRKCO" >
      <Attribute ID="EntityType" Value="Agent" />
      <Attribute ID="Role" Value="Member" />
    </Entity>
    <Entity Name="11-AVN-RGT" >
      <Attribute ID="EntityType" Value="Agent" />
      <Attribute ID="Role" Value="Member" />
    </Entity>
    <Entity Name="110-POL-SUPPLYCO" >
      <Attribute ID="EntityType" Value="Agent" />
      <Attribute ID="Role" Value="Member" />
    </Entity>
    <Entity Name="12-AVNBDE" >
      <Attribute ID="EntityType" Value="Agent" />
      <Attribute ID="Role" Value="Member" />
    </Entity>
    <Entity Name="123-MSB" >
      <Attribute ID="EntityType" Value="Agent" />
      <Attribute ID="Role" Value="Member" />
    </Entity>
    <Entity Name="125-FSB" >
      <Attribute ID="EntityType" Value="Agent" />
      <Attribute ID="Role" Value="Member" />
    </Entity>
    <Entity Name="125-ORDBN" >
      <Attribute ID="EntityType" Value="Agent" />
      <Attribute ID="Role" Value="Member" />
    </Entity>
    <Entity Name="127-DASB" >
      <Attribute ID="EntityType" Value="Agent" />
      <Attribute ID="Role" Value="Member" />
    </Entity>
    <Entity Name="130-ENGBDE" >
      <Attribute ID="EntityType" Value="Agent" />
      <Attribute ID="Role" Value="Member" />
    </Entity>
    <Entity Name="141-SIGBN" >
      <Attribute ID="EntityType" Value="Agent" />
      <Attribute ID="Role" Value="Member" />
    </Entity>
    <Entity Name="15-PLS-TRKCO" >
      <Attribute ID="EntityType" Value="Agent" />
      <Attribute ID="Role" Value="Member" />
    </Entity>
    <Entity Name="16-CSG" >
      <Attribute ID="EntityType" Value="Agent" />
      <Attribute ID="Role" Value="Member" />
    </Entity>
    <Entity Name="16-ENGBN" >
      <Attribute ID="EntityType" Value="Agent" />
      <Attribute ID="Role" Value="Member" />
    </Entity>
    <Entity Name="18-MAINTBN" >
      <Attribute ID="EntityType" Value="Agent" />
      <Attribute ID="Role" Value="Member" />
    </Entity>
    <Entity Name="18-MPBDE" >
      <Attribute ID="EntityType" Value="Agent" />
      <Attribute ID="Role" Value="Member" />
    </Entity>
    <Entity Name="18-PERISH-SUBPLT" >
      <Attribute ID="EntityType" Value="Agent" />
      <Attribute ID="Role" Value="Member" />
    </Entity>
    <Entity Name="181-TCBN" >
      <Attribute ID="EntityType" Value="Agent" />
      <Attribute ID="Role" Value="Member" />
    </Entity>
    <Entity Name="19-MMC" >
      <Attribute ID="EntityType" Value="Agent" />
      <Attribute ID="Role" Value="Member" />
    </Entity>
    <Entity Name="191-ORDBN" >
      <Attribute ID="EntityType" Value="Agent" />
      <Attribute ID="Role" Value="Member" />
    </Entity>
    <Entity Name="2-3-FABN" >
      <Attribute ID="EntityType" Value="Agent" />
      <Attribute ID="Role" Value="Member" />
    </Entity>
    <Entity Name="2-37-ARBN" >
      <Attribute ID="EntityType" Value="Agent" />
      <Attribute ID="Role" Value="Member" />
    </Entity>
    <Entity Name="2-4-FABN-MLRS" >
      <Attribute ID="EntityType" Value="Agent" />
      <Attribute ID="Role" Value="Member" />
    </Entity>
    <Entity Name="2-501-AVNBN" >
      <Attribute ID="EntityType" Value="Agent" />
      <Attribute ID="Role" Value="Member" />
    </Entity>
    <Entity Name="2-6-INFBN" >
      <Attribute ID="EntityType" Value="Agent" />
      <Attribute ID="Role" Value="Member" />
    </Entity>
    <Entity Name="2-70-ARBN" >
      <Attribute ID="EntityType" Value="Agent" />
      <Attribute ID="Role" Value="Member" />
    </Entity>
    <Entity Name="2-BDE-1-AD" >
      <Attribute ID="EntityType" Value="Agent" />
      <Attribute ID="Role" Value="Member" />
    </Entity>
    <Entity Name="200-MMC" >
      <Attribute ID="EntityType" Value="Agent" />
      <Attribute ID="Role" Value="Member" />
    </Entity>
    <Entity Name="205-MIBDE" >
      <Attribute ID="EntityType" Value="Agent" />
      <Attribute ID="Role" Value="Member" />
    </Entity>
    <Entity Name="208-SCCO" >
      <Attribute ID="EntityType" Value="Agent" />
      <Attribute ID="Role" Value="Member" />
    </Entity>
    <Entity Name="21-TSC-HQ" >
      <Attribute ID="EntityType" Value="Agent" />
      <Attribute ID="Role" Value="Member" />
    </Entity>
    <Entity Name="22-SIGBDE" >
      <Attribute ID="EntityType" Value="Agent" />
      <Attribute ID="Role" Value="Member" />
    </Entity>
    <Entity Name="226-MAINTCO" >
      <Attribute ID="EntityType" Value="Agent" />
      <Attribute ID="Role" Value="Member" />
    </Entity>
    <Entity Name="227-SUPPLYCO" >
      <Attribute ID="EntityType" Value="Agent" />
      <Attribute ID="Role" Value="Member" />
    </Entity>
    <Entity Name="23-ORDCO" >
      <Attribute ID="EntityType" Value="Agent" />
      <Attribute ID="Role" Value="Member" />
    </Entity>
    <Entity Name="238-POL-TRKCO" >
      <Attribute ID="EntityType" Value="Agent" />
      <Attribute ID="Role" Value="Member" />
    </Entity>
    <Entity Name="24-ORDCO" >
      <Attribute ID="EntityType" Value="Agent" />
      <Attribute ID="Role" Value="Member" />
    </Entity>
    <Entity Name="240-SSCO" >
      <Attribute ID="EntityType" Value="Agent" />
      <Attribute ID="Role" Value="Member" />
    </Entity>
    <Entity Name="244-ENGBN-CBTHVY" >
      <Attribute ID="EntityType" Value="Agent" />
      <Attribute ID="Role" Value="Member" />
    </Entity>
    <Entity Name="25-FABTRY-TGTACQ" >
      <Attribute ID="EntityType" Value="Agent" />
      <Attribute ID="Role" Value="Member" />
    </Entity>
    <Entity Name="26-SSCO" >
      <Attribute ID="EntityType" Value="Agent" />
      <Attribute ID="Role" Value="Member" />
    </Entity>
    <Entity Name="263-FLDSVC-CO" >
      <Attribute ID="EntityType" Value="Agent" />
      <Attribute ID="Role" Value="Member" />
    </Entity>
    <Entity Name="27-TCBN-MVTCTRL" >
      <Attribute ID="EntityType" Value="Agent" />
      <Attribute ID="Role" Value="Member" />
    </Entity>
    <Entity Name="28-TCBN" >
      <Attribute ID="EntityType" Value="Agent" />
      <Attribute ID="Role" Value="Member" />
    </Entity>
    <Entity Name="286-ADA-SCCO" >
      <Attribute ID="EntityType" Value="Agent" />
      <Attribute ID="Role" Value="Member" />
    </Entity>
    <Entity Name="29-SPTGP" >
      <Attribute ID="EntityType" Value="Agent" />
      <Attribute ID="Role" Value="Member" />
    </Entity>
    <Entity Name="3-13-FABN-155" >
      <Attribute ID="EntityType" Value="Agent" />
      <Attribute ID="Role" Value="Member" />
    </Entity>
    <Entity Name="3-BDE-1-AD" >
      <Attribute ID="EntityType" Value="Agent" />
      <Attribute ID="Role" Value="Member" />
    </Entity>
    <Entity Name="3-SUPCOM-HQ" >
      <Attribute ID="EntityType" Value="Agent" />
      <Attribute ID="Role" Value="Member" />
    </Entity>
    <Entity Name="30-MEDBDE" >
      <Attribute ID="EntityType" Value="Agent" />
      <Attribute ID="Role" Value="Member" />
    </Entity>
    <Entity Name="316-POL-SUPPLYBN" >
      <Attribute ID="EntityType" Value="Agent" />
      <Attribute ID="Role" Value="Member" />
    </Entity>
    <Entity Name="317-MAINTCO" >
      <Attribute ID="EntityType" Value="Agent" />
      <Attribute ID="Role" Value="Member" />
    </Entity>
    <Entity Name="343-SUPPLYCO" >
      <Attribute ID="EntityType" Value="Agent" />
      <Attribute ID="Role" Value="Member" />
    </Entity>
    <Entity Name="37-TRANSGP" >
      <Attribute ID="EntityType" Value="Agent" />
      <Attribute ID="Role" Value="Member" />
    </Entity>
    <Entity Name="372-CGO-TRANSCO" >
      <Attribute ID="EntityType" Value="Agent" />